{"binding_sha256":"dd658094e18ae0b388d7c1e242ac25d6b2097df6fe4c3e6cda675a305879246d","complete":true,"logical_types":[{"logical_name":"cord.storage.ChunkLocation.v1","portable_id":104,"shape_sha256":"58c96e3c8f52744005ee38a9569368728c58fcc35834acce30c80ac2e8c1685c","type_path":"cord::storage::ChunkLocationV1"},{"logical_name":"cord.storage.Commitment.v1","portable_id":103,"shape_sha256":"bf28346166d2fbb12fc3dfa54d12a597e7c11ffab0098c8005e6736e9feee79b","type_path":"cord::storage::CommitmentV1"},{"logical_name":"cord.storage.CommitmentPayload.v2","portable_id":105,"shape_sha256":"432f2f1bb9c7c0e14a740bafa147f176b276b4901914408ea29feb33e90da44f","type_path":"cord::storage::CommitmentPayloadV2"},{"logical_name":"cord.storage.MmrLeaf.v1","portable_id":101,"shape_sha256":"4a27c949d5814f480f98e3f4b2f9f3dae77935d0857cdb7d448df7e4e79cf0f9","type_path":"cord::storage::MmrLeafV1"},{"logical_name":"cord.storage.MmrProof.v1","portable_id":102,"shape_sha256":"023851ec0df29836176b6eca91199c9437a0b135777ba552d231e053b680250c","type_path":"cord::storage::MmrProofV1"}],"logical_types_spec_sha256":"e0d6172450765a9951ee13bd7e8d25ff64b9e7d3065d417a345ff17ca7821af3","metadata_sha256":"48ba17ec5b88b07cbcb60fc30d9c8f49f358fa4b18628b9748f98a91424b09b7","portable_registry_sha256":"9e2c07eb16e28650bda4b01657c7fe27748ead260821fdcf1931e5110d1723af","runtime":"origin-commons-runtime","schema_version":1}